{
  "schema_version": "laicode.evolution-contract.v0",
  "name": "cache-policy",
  "epoch": "prototype-0",
  "expires_at": "2026-12-31T23:59:59Z",
  "subject": {
    "kind": "pure_function",
    "entrypoint": "cache.select_victim",
    "input_schema": "CacheSnapshotV0",
    "output_schema": "CacheKeyV0",
    "correctness_oracle": "cache.valid_victim.v0",
    "fallback": "reviewed.lru_select_victim",
    "state": "none"
  },
  "profiles": {
    "initial": {
      "r": "R2",
      "m": "M0",
      "g": "G0",
      "l": "L0",
      "d": "D0",
      "f": "F0"
    },
    "maximum_reviewed": {
      "r": "R3",
      "m": "M1",
      "g": "G1",
      "l": "L1",
      "d": "D1",
      "f": "F3"
    }
  },
  "mutation": {
    "level": "M1",
    "kind": "strategy_selection",
    "candidate_ir": "CacheStrategySelectionV0",
    "allowed_strategy_ids": ["fifo", "lfu", "lru"],
    "mutable_regions": ["eviction_strategy"],
    "max_artifact_bytes": 4096
  },
  "capabilities": {
    "default": "deny",
    "filesystem": "deny",
    "network": "deny",
    "process": "deny",
    "clock": "deny",
    "randomness": "deny",
    "environment": "deny",
    "credentials": "deny",
    "model": "deny",
    "external_services": "deny"
  },
  "constraints": [
    {
      "id": "effects_are_pure",
      "enforcement": "prove",
      "oracle": "cache.effect_checker.v0",
      "failure_action": "reject_candidate"
    },
    {
      "id": "result_is_evictable",
      "enforcement": "runtime_enforce",
      "oracle": "cache.result_is_evictable.v0",
      "failure_action": "fallback"
    },
    {
      "id": "result_is_not_pinned",
      "enforcement": "runtime_enforce",
      "oracle": "cache.result_is_not_pinned.v0",
      "failure_action": "fallback"
    },
    {
      "id": "replay_is_deterministic",
      "enforcement": "test",
      "oracle": "cache.replay_determinism.v0",
      "failure_action": "reject_candidate"
    }
  ],
  "objectives": [
    {
      "id": "miss_ratio",
      "direction": "minimize",
      "role": "primary",
      "unit": "ratio",
      "population": "cache_accesses",
      "denominator": "cacheable_requests",
      "window": "complete_trace",
      "missing_data": "reject_candidate",
      "practical_delta_ppm": 20000,
      "noninferiority_tolerance_ppm": 0
    },
    {
      "id": "decision_cost",
      "direction": "minimize",
      "role": "protected",
      "unit": "semantic_steps",
      "population": "eviction_decisions",
      "denominator": "decisions",
      "window": "complete_trace",
      "missing_data": "worst_case",
      "practical_delta_ppm": 0,
      "noninferiority_tolerance_ppm": 50000
    }
  ],
  "comparison": {
    "method": "constrained",
    "uncertainty_method": "deterministic_exact_exploratory",
    "epoch_error_budget_ppm": 50000,
    "maximum_comparisons": 2,
    "minimum_events_per_partition": 256,
    "historical_regression_tolerance_ppm": 0,
    "candidate_churn_limit": 3,
    "promotion_limit": 1,
    "tie_breaker": "lower_risk_then_simpler"
  },
  "evidence": {
    "search": {
      "source": "cache.search_traces.v0",
      "candidate_access": true,
      "disclosure": "full"
    },
    "operational_holdout": {
      "source": "cache.selection_traces.v0",
      "candidate_access": false,
      "disclosure": "aggregate"
    },
    "research_audit": {
      "source": "cache.audit_traces.v0",
      "candidate_access": false,
      "disclosure": "none"
    },
    "prospective": {
      "source": "cache.future_traces.v0",
      "candidate_access": false,
      "disclosure": "aggregate"
    },
    "historical_regression": {
      "source": "cache.regression_traces.v0",
      "candidate_access": false,
      "disclosure": "aggregate"
    }
  },
  "budgets": {
    "per_candidate": {
      "cpu_milliseconds": 10000,
      "wall_milliseconds": 15000,
      "memory_bytes": 268435456,
      "storage_bytes": 10485760,
      "processes": 1,
      "network_bytes": 0,
      "evaluator_queries": 10,
      "model_tokens": 0,
      "money_microusd": 0
    },
    "per_epoch": {
      "candidates": 100,
      "cpu_milliseconds": 1000000,
      "wall_milliseconds": 1500000,
      "memory_bytes": 268435456,
      "storage_bytes": 1073741824,
      "processes": 8,
      "network_bytes": 0,
      "evaluator_queries": 1000,
      "model_tokens": 0,
      "money_microusd": 0
    }
  },
  "halt_conditions": [
    "budget_exhaustion",
    "contract_expiry",
    "evaluator_failure",
    "evidence_integrity_failure"
  ]
}
